{
  "spec_version": "0.1.0",
  "endpoint": "/v1/records",
  "method": "POST",
  "authentication": {
    "required": true,
    "schemes": ["bearer", "api_key"]
  },
  "request": {
    "content_type": "application/json"
  },
  "response": {
    "success_status": 200,
    "error_format": {
      "type": "rfc7807"
    },
    "max_latency_ms": 2000
  },
  "rate_limit": {
    "requests_per_minute": 300,
    "burst": 50
  }
}
